{
  "id": "wire-outcome-null-phase",
  "channel": "serialization",
  "kind": "transport-codec",
  "summary": "Inactive outcome codec null phase",
  "transport": "outcome",
  "payload": {
    "schemaVersion": 1,
    "kind": "launch",
    "command": "launch-target",
    "requestId": "request-01",
    "sequence": 5,
    "phase": null,
    "status": "succeeded",
    "sessionId": "session-01",
    "blocks": []
  },
  "expect": {
    "csharp": {
      "outcome": "reject",
      "errorCodes": [
        "transport"
      ]
    },
    "dart": {
      "outcome": "reject",
      "errorCodes": [
        "transport"
      ]
    }
  }
}
