{
  "id": "v6-contributions-without-world-service",
  "channel": "serialization",
  "kind": "manifest-rejects",
  "summary": "Declaring a launch surface means owning worlds at runtime, and world-service is the capability that discloses it. Enforced in both readers because only one of them ever sees the schema.",
  "manifest": {
    "$schema": "https://raw.githubusercontent.com/furroxide/TopiaForge/main/schemas/topiaforge.mod.v6.schema.json",
    "schemaVersion": 6,
    "name": "io.github.furroxide.topiaforge.fixture",
    "displayName": "Contract Fixture",
    "version": "1.0.0",
    "author": {
      "name": "TopiaForge"
    },
    "entryAssembly": "Fixture.dll",
    "entryType": "Fixture.Mod",
    "supportedGameVersionRange": "*",
    "supportedLoaderVersionRange": "*",
    "supportedSdkVersionRange": "*",
    "contributions": {
      "gamemodes": [
        {
          "id": "io.github.furroxide.topiaforge.fixture.survival",
          "name": "Survival",
          "implementation": {
            "type": "Fixture.SurvivalGamemode"
          }
        }
      ]
    }
  },
  "expect": {
    "csharp": {
      "outcome": "reject",
      "errorCodes": [
        "contributions"
      ]
    },
    "dart": {
      "outcome": "reject",
      "errorCodes": [
        "contributions"
      ]
    }
  }
}
