{
  "id": "v6-consent-over-limit",
  "channel": "serialization",
  "kind": "manifest-rejects",
  "summary": "v6 consent over limit.",
  "manifest": {
    "$schema": "https://raw.githubusercontent.com/furroxide/TopiaForge/main/schemas/topiaforge.mod.v6.schema.json",
    "schemaVersion": 6,
    "name": "io.github.furroxide.topiaforge.fixture",
    "displayName": "Contract Fixture",
    "version": "1.0.0",
    "author": {
      "name": "TopiaForge"
    },
    "entryAssembly": "Fixture.dll",
    "entryType": "Fixture.Mod",
    "supportedGameVersionRange": "*",
    "supportedLoaderVersionRange": "*",
    "supportedSdkVersionRange": "*",
    "capabilities": [
      "world-service"
    ],
    "contributions": {
      "worlds": [
        {
          "id": "io.github.furroxide.topiaforge.fixture.arena",
          "name": "Arena",
          "content": {
            "kind": "bundle",
            "bundle": "Content/arena.bundle",
            "prefab": "Arena"
          },
          "transitions": [
            "additive-arena"
          ],
          "spawn": {
            "kind": "provider-default"
          },
          "openTo": [
            "io.example.other.mode0",
            "io.example.other.mode1",
            "io.example.other.mode2",
            "io.example.other.mode3",
            "io.example.other.mode4",
            "io.example.other.mode5",
            "io.example.other.mode6",
            "io.example.other.mode7",
            "io.example.other.mode8",
            "io.example.other.mode9",
            "io.example.other.mode10",
            "io.example.other.mode11",
            "io.example.other.mode12",
            "io.example.other.mode13",
            "io.example.other.mode14",
            "io.example.other.mode15",
            "io.example.other.mode16",
            "io.example.other.mode17",
            "io.example.other.mode18",
            "io.example.other.mode19",
            "io.example.other.mode20",
            "io.example.other.mode21",
            "io.example.other.mode22",
            "io.example.other.mode23",
            "io.example.other.mode24",
            "io.example.other.mode25",
            "io.example.other.mode26",
            "io.example.other.mode27",
            "io.example.other.mode28",
            "io.example.other.mode29",
            "io.example.other.mode30",
            "io.example.other.mode31",
            "io.example.other.mode32"
          ]
        }
      ],
      "gamemodes": [
        {
          "id": "io.github.furroxide.topiaforge.fixture.survival",
          "name": "Survival",
          "implementation": {
            "type": "Fixture.SurvivalGamemode"
          }
        }
      ],
      "launchTargets": [
        {
          "id": "io.github.furroxide.topiaforge.fixture.play",
          "title": "Play",
          "gamemode": "io.github.furroxide.topiaforge.fixture.survival",
          "world": {
            "policy": "fixed",
            "default": "io.github.furroxide.topiaforge.fixture.arena"
          }
        }
      ]
    },
    "dependencies": {
      "io.example.other": "*"
    }
  },
  "schemaOutcome": "reject",
  "expect": {
    "csharp": {
      "outcome": "reject",
      "errorCodes": [
        "contributions"
      ]
    },
    "dart": {
      "outcome": "reject",
      "errorCodes": [
        "contributions"
      ]
    }
  }
}
