{
  "id": "wire-progress-unknown-phase",
  "channel": "serialization",
  "kind": "transport-codec",
  "summary": "Inactive progress codec unknown phase",
  "transport": "progress",
  "payload": {
    "schemaVersion": 1,
    "requestId": "request-01",
    "sequence": 3,
    "phase": "draining",
    "nativeBusy": true
  },
  "expect": {
    "csharp": {
      "outcome": "reject",
      "errorCodes": [
        "transport"
      ]
    },
    "dart": {
      "outcome": "reject",
      "errorCodes": [
        "transport"
      ]
    }
  }
}
