{
  "id": "wire-plan-duplicate-package",
  "channel": "serialization",
  "kind": "transport-codec",
  "summary": "Inactive plan codec duplicate package",
  "transport": "plan",
  "payload": {
    "targetId": "base.mod.menu",
    "gamemodeId": "mode.mod.play",
    "worldId": "base.mod.world",
    "transition": "scene-replacement",
    "request": {
      "targetId": "BASE.MOD.MENU"
    },
    "packages": [
      {
        "id": "base.mod",
        "version": "1.0.0"
      },
      {
        "id": "mode.mod",
        "version": "2.3.4"
      },
      {
        "id": "BASE.MOD",
        "version": "1.0.0"
      }
    ],
    "digest": "6a4a1aa84ed69e17"
  },
  "expect": {
    "csharp": {
      "outcome": "reject",
      "errorCodes": [
        "transport"
      ]
    },
    "dart": {
      "outcome": "reject",
      "errorCodes": [
        "transport"
      ]
    }
  }
}
