{
  "id": "missing-required-longer-gamemode-owner",
  "channel": "resolution",
  "kind": "launch-resolution",
  "summary": "missing required longer gamemode owner",
  "profile": {
    "packages": [
      {
        "id": "base.mod",
        "version": "1.0.0",
        "manifest": {
          "$schema": "https://raw.githubusercontent.com/furroxide/TopiaForge/main/schemas/topiaforge.mod.schema.json",
          "schemaVersion": 6,
          "name": "base.mod",
          "displayName": "worlds",
          "version": "1.0.0",
          "author": {
            "name": "TopiaForge"
          },
          "entryAssembly": "Fixture.dll",
          "entryType": "Fixture.Mod",
          "supportedGameVersionRange": "*",
          "supportedLoaderVersionRange": "*",
          "supportedSdkVersionRange": "*",
          "capabilities": [
            "world-service"
          ],
          "contributions": {
            "worlds": [
              {
                "id": "base.mod.open_sandbox",
                "name": "open_sandbox",
                "content": {
                  "kind": "game-scene",
                  "sceneName": "UgcPlay"
                },
                "transitions": [
                  "additive-arena",
                  "scene-replacement"
                ],
                "spawn": {
                  "kind": "provider-default"
                },
                "openToAnyCompatible": true
              }
            ],
            "gamemodes": [
              {
                "id": "base.mod.freeplay",
                "name": "freeplay",
                "implementation": {
                  "type": "Fixture.Gamemode"
                }
              }
            ],
            "launchTargets": [
              {
                "id": "base.mod.freeplay.menu",
                "title": "menu",
                "gamemode": "base.mod.extra.item",
                "world": {
                  "policy": "open",
                  "default": "base.mod.open_sandbox",
                  "allowPlayerOverride": true
                }
              }
            ]
          },
          "dependencies": {
            "base.mod.extra": "*"
          }
        },
        "schemaOutcome": "accept",
        "validation": {
          "outcome": "accept"
        }
      }
    ]
  },
  "request": {
    "targetId": "base.mod.freeplay.menu"
  },
  "expect": {
    "csharp": {
      "outcome": "reject",
      "blocks": [
        {
          "code": "gamemodeNotDeclared",
          "subject": "base.mod.extra.item",
          "subjectVersion": ""
        }
      ]
    },
    "dart": {
      "outcome": "reject",
      "blocks": [
        {
          "code": "gamemodeNotDeclared",
          "subject": "base.mod.extra.item",
          "subjectVersion": ""
        }
      ]
    }
  }
}
