{
  "id": "wire-observation-family-95-empty-suffix",
  "channel": "serialization",
  "kind": "transport-codec",
  "summary": "A discovered instance requires a nonempty suffix after its family separator, even when the total identifier fits the length limit.",
  "transport": "observation",
  "payload": {
    "schemaVersion": 1,
    "profileId": "profile-01",
    "profileRevision": 7,
    "producer": {
      "id": "base.mod",
      "version": "1.0.0"
    },
    "packageSetDigest": "6a4a1aa84ed69e17",
    "observationRevision": 3,
    "discoveredWorlds": [
      {
        "id": "base.mod.xxxxxxxxxxxxxxxxxxxxxxxxxxxxxxxxxxxxxxxxxxxxxxxxxxxxxxxxxxxxxxxxxxxxxxxxxxxxxxxxxxxxxx.",
        "familyId": "base.mod.xxxxxxxxxxxxxxxxxxxxxxxxxxxxxxxxxxxxxxxxxxxxxxxxxxxxxxxxxxxxxxxxxxxxxxxxxxxxxxxxxxxxxx",
        "name": "Boundary instance"
      }
    ],
    "availability": []
  },
  "expect": {
    "csharp": {
      "outcome": "reject",
      "errorCodes": [
        "transport"
      ]
    },
    "dart": {
      "outcome": "reject",
      "errorCodes": [
        "transport"
      ]
    }
  }
}
